{
  "id": "iron-man",
  "type": "movie",
  "title": "Iron Man",
  "releaseDate": "2008-05-02",
  "overview": "A weapons manufacturer builds a powered suit after being captured.",
  "tmdb": {"id": 1726, "url": "https://www.themoviedb.org/movie/1726"},
  "assets": {
    "poster": {"path": null, "status": "missing", "source": null},
    "backdrop": {"path": null, "status": "optional", "source": null},
    "logo": {"path": "assets/logos/iron-man.svg", "status": "available", "source": "Locally authored starter SVG wordmark; not official franchise artwork"}
  }
}